<?xml version="1.0"?>

<cuboidsInput
xmlns:xsi="http://www.w3.org/2001/XMLSchema-instance"
xsi:noNamespaceSchemaLocation="XMLInput.xsd">

	<meshWidth>1.1225</meshWidth>
	<sigma>1.0</sigma>
	<epsilon>5.0</epsilon>
	<mass>1.0</mass>
	<t_end>5.0</t_end>
	<delta_t>0.0002</delta_t>
	<meanVelocity>0.1</meanVelocity>	

	<cuboid>
		<originVector>
			<oriX>0.0</oriX>
			<oriY>0.0</oriY>
			<oriZ>0.0</oriZ>
		</originVector>
		<startVelocity>
			<velX>0.0</velX>
			<velY>0.0</velY>
			<velZ>0.0</velZ>
		</startVelocity>
		<size>
			<width>40</width>
			<height>8</height>
			<depth>1</depth>
		</size>		
	</cuboid>	

	<cuboid>
		<originVector>
			<oriX>15.0</oriX>
			<oriY>15.0</oriY>
			<oriZ>0.0</oriZ>
		</originVector>  		
		<startVelocity>
			<velX>0.0</velX>
			<velY>-10.0</velY>
			<velZ>0.0</velZ>
		</startVelocity>
		<size>
			<width>8</width>
			<height>8</height>
			<depth>1</depth>
		</size>	
	</cuboid>

</cuboidsInput> 
